{
  "$schema": "https://json-schema.org/draft/2020-12/schema",
  "$id": "https://stegverse.org/schemas/public-inspection-request.v1.json",
  "title": "StegVerse Public Inspection Request",
  "type": "object",
  "additionalProperties": false,
  "required": [
    "schema_version",
    "request_id",
    "case_profile",
    "execution_provenance",
    "input",
    "return_projection",
    "authority_claim"
  ],
  "properties": {
    "schema_version": {"const": "1.0"},
    "request_id": {"type": "string", "pattern": "^[A-Za-z0-9._-]{3,80}$"},
    "requester_label": {"type": "string", "maxLength": 120},
    "case_profile": {"type": "string", "enum": ["ordinary", "longitudinal-boundary", "custom-declarative"]},
    "evaluation_declaration": {
      "type": "object",
      "additionalProperties": false,
      "required": ["what", "how", "why"],
      "properties": {
        "what": {"type": "string", "minLength": 1, "maxLength": 1000},
        "how": {"type": "string", "minLength": 1, "maxLength": 1000},
        "why": {"type": "string", "minLength": 1, "maxLength": 1000},
        "expected_observation": {"type": "string", "maxLength": 1000},
        "requested_capabilities": {
          "type": "array",
          "uniqueItems": true,
          "maxItems": 5,
          "items": {
            "type": "string",
            "enum": [
              "commit_time_admissibility",
              "bounded_consequence",
              "master_records_organization_record",
              "master_records_organization_record",
              "replay",
              "reconstruction"
            ]
          }
        },
        "requested_evidence": {
          "type": "array",
          "uniqueItems": true,
          "maxItems": 7,
          "items": {
            "type": "string",
            "enum": [
              "governance_decision",
              "execution_observation",
              "manifest_receipt",
              "route_receipts",
              "exact_run_custody",
              "replay",
              "reconstruction"
            ]
          }
        }
      }
    },
    "execution_provenance": {
      "type": "object",
      "additionalProperties": false,
      "required": [
        "lane_class",
        "routing_surface",
        "containment",
        "sandbox_required",
        "external_consequence_enabled"
      ],
      "properties": {
        "route_id": {"type": "string", "minLength": 1, "maxLength": 200},
        "route_declaration_hash": {"type": "string", "pattern": "^[0-9a-fA-F]{64}$"},
        "state_binding_hash": {"type": "string", "pattern": "^[0-9a-fA-F]{64}$"},
        "lane_class": {
          "type": "string",
          "enum": ["PRODUCTION_VALIDATION", "ENCLOSED_DEMO_TEST"]
        },
        "routing_surface": {
          "type": "string",
          "enum": ["CANONICAL_PRODUCTION", "DEMO_TEST_REPOSITORY"]
        },
        "containment": {
          "type": "string",
          "enum": ["PRODUCTION_ROUTE_BOUNDED_CONSEQUENCE", "DEMO_REPOSITORY_CONTAINED"]
        },
        "sandbox_required": {"type": "boolean"},
        "sandbox_tier": {"type": "string", "maxLength": 120},
        "origin_surface": {"type": "string", "maxLength": 200},
        "external_consequence_enabled": {"type": "boolean"},
        "execution_host_class": {"type": "string", "maxLength": 120},
        "execution_host_identity": {"type": "string", "maxLength": 200},
        "third_party_host_required": {"type": "boolean"}
      },
      "allOf": [
        {
          "if": {"properties": {"lane_class": {"const": "PRODUCTION_VALIDATION"}}},
          "then": {
            "properties": {
              "routing_surface": {"const": "CANONICAL_PRODUCTION"},
              "containment": {"const": "PRODUCTION_ROUTE_BOUNDED_CONSEQUENCE"},
              "external_consequence_enabled": {"const": false}
            }
          }
        },
        {
          "if": {"properties": {"lane_class": {"const": "ENCLOSED_DEMO_TEST"}}},
          "then": {
            "properties": {
              "routing_surface": {"const": "DEMO_TEST_REPOSITORY"},
              "containment": {"const": "DEMO_REPOSITORY_CONTAINED"},
              "sandbox_required": {"const": true},
              "external_consequence_enabled": {"const": false}
            }
          }
        }
      ]
    },
    "input": {"type": "object", "maxProperties": 50},
    "return_projection": {"type": "string", "enum": ["ALL", "SELECTED", "NONE"]},
    "manifest_labels": {"type": "boolean", "default": false},
    "authority_claim": {"const": false},
    "notes": {"type": "string", "maxLength": 2000}
  }
}
